"Tilda UID";Brand;SKU;Mark;Category;Title;Description;Text;Photo;Price;Quantity;"Price Old";Editions;Modifications;"External ID";"Parent UID";Characteristics:Страна;Characteristics:Винтаж;Characteristics:Регион;Characteristics:Состав;Characteristics:Объем;Characteristics:Алк.;Characteristics:PR;Characteristics:Субрегион;Characteristics:WS;Characteristics:Тип;Characteristics:Vinous;Characteristics:JS;Characteristics:RP;"Characteristics:Страна производства";Characteristics:Производитель;Characteristics:Материал;Weight;Length;Width;Height;"SEO title";"SEO descr";"FB title";"FB descr";Url
679935572451;Leflaive;;;"Франция;Избранное 2;MarketWinetime;Domanie Leflaive;Бургундия";"Domaine Leflaive, Puligny-Montrachet Les Folatieres 1994 (1er Cru), 750 ml";Бургундия;"Ручной сбор и сортировка. Алкогольная ферментация в дубовых бочках (20% новых). Выдержка сначала в дубовых бочках в течение 12 месяцев, а затем 6 месяцев в нейтральных танках. При необходимости проводится легкая фильтрация.#nbsp;";https://static.tildacdn.com/tild3133-6633-4431-a366-316361613762/126000-x-4000.jpg;128700.00;;;;;GXe6zRXJcu11TJ9N3d6H;;Франция;1994;Бургундия;Шардоне;0,75;13,50%;;;;Белое;;;;;;;0;0;0;0;;;;;https://winetime.moscow/puligny-montrachet-lf-1994
639066594521;Leflaive;;;"Франция;Избранное 2;MarketWinetime;Domanie Leflaive;Бургундия";"Domaine Leflaive, Puligny-Montrachet Les Folatieres 2018 (1er Cru), 750 ml";Бургундия;"У этого очаровательного Ле Фолатье 2018 аромат свежих садовых фруктов, белого персика, меда, миндаля и белых цветов. Вино среднетельное, близко к полнотельному, шелковистое. Оно очень элегантно раскрывается и проявляет яркую, чрезвычайно привлекательную индивидуальность.#nbsp;#nbsp;#nbsp;<br /><em>Wine Advocate, 2021</em>";https://static.tildacdn.com/tild3063-3539-4638-b862-383566623764/236000-x-4000.jpg;76700.00;;;;;ejHD6GxGkSRAUe9Nx5Ly;;Франция;2018;Бургундия;Шардоне;0,75;13%;;;;Белое;;;92;;;;0;0;0;0;;;;;https://winetime.moscow/puligny-montrachet-lf-2018
300401524361;"Bonnes Mares";;;"Франция;MarketWinetime;продано;Domaine Louis Jadot;Бургундия";"Bonnes Mares Grand Cru Domaine Louis Jadot 2009, 750 ml";Бургундия;"Ручной сбор, гребнеотделение и сортировка. Ферментация и мацерация в течение 3-4 недель в нейтральных чанах. Выдержка в дубовых бочках собственного производства в течение 18 месяцев.";https://static.tildacdn.com/tild3361-3463-4164-a234-666634633733/156000-x-4000.jpg;89700.00;;;;;czlKLvPjyiEXBHZPIGmh;;Франция;2009;Бургундия;"Пино Нуар";0,75;13,50%;;;;Красное;;;95;;;;0;0;0;0;;;;;https://winetime.moscow/bonnes-mares-lj-2009
810006975051;"Bouchard Pere Fils";;;"Новинки;Франция;MarketWinetime;Bouchard Pere Fils;Бургундия";"Bouchard Pere Fils, Chevalier Montrachet Grand Cru 2018, 750 ml";Бургундия;"Шевалье-Монраше Гран Крю 2018 - превосходное. В бокале раскрывается аппетитный аромат бриошь, хрустящих садовых яблок, цитрусового масла и мускатного ореха. Вино среднетельное, довольно плотное, устойчивое - очень обаятельное и выразительное, оно более открытое, чем винтаж 2017 в том же возрате. Оно скорее напоминает не столь маскулинный, но при этом мощный 2015. У него будет очень большое окно зрелости: уже сейчас это вино очень открытое.<br /><strong>Wine Advocate, 2020</strong>";https://static.tildacdn.com/tild3661-3035-4261-a234-316339393461/ccdb-5.jpg;89000.00;;;;;HSG80iSaiaGBizmtFBG3;;Франция;2014;Бургундия;"Пино Нуар";0,75;13%;;;;Красное;;;96;;;;0;0;0;0;;;;;https://winetime.moscow/dbpef-monrachet-2018
161462031181;"Bouchard Pere Fils";;;"Франция;MarketWinetime;Bouchard Pere Fils;Бургундия";"Bouchard Pere Fils Chambertin-Clos de Beze Grand Cru 2015, 750 ml";Бургундия;"Шамбертен Кло де Безе 2015 обладает прекрасным ароматом: клюква, подлесок, сухая апельсиновая цедра. Вино хорошо сбалансировано, с мягкими танинами, заметной кислотностью и хорошо интегрированной дубовой нотой. Во рту вкус совершенствуется и ближе к финишу приобретает приятную гармонию. 4-6 лет в бутылке, и оно превратится в очень элегантное классическое бургундское вино.#nbsp;<br /><em>Wine Advocate, 2016</em>";https://static.tildacdn.com/tild3735-6166-4537-a230-626233333662/DSC_0170.jpg;89700.00;;;;;m0JNnrYZyK5397deyOo7;;Франция;2015;Бургундия;"Пино Нуар";0,75;13,50%;93;;;Красное;;;;;;;0;0;0;0;;;;;https://winetime.moscow/chambertin-clos-de-beze-2015
341849475581;"Bouchard Pere Fils";;;"Франция;MarketWinetime;Bouchard Pere Fils;Бургундия";"Bouchard Pere Fils Chambertin-Clos de Beze Grand Cru 2018, 750 ml";Бургундия;"Шамбертен Кло де Безе 2018 - самое сочное, крепкое (15%) и мощное вино у Бушаров, чьи виноградари в тот год настояли на особенно позднем сборе. У него экстравагантный аромат: апельсиновая цедра, малина, слива, лепестки розы, фимиам, пряный дуб. Вино полнотельное, густое и многослойное. Очень фруктовое, с мягкими танинами и заметным алкоголем. Хорошая работа, но не думаю, что у него большой потенциал хранения.<br /><em>Wine Advocate, 2020</em>";https://static.tildacdn.com/tild3032-6363-4432-a164-323466386463/166000-x-4000.jpg;87100.00;;;;;TZ7ozgOVu9np0KoOOKv4;;Франция;2018;Бургундия;"Пино Нуар";0,75;15%;;;;Красное;;;92;;;;0;0;0;0;;;;;https://winetime.moscow/chambertin-clos-de-beze-2018
748302114841;"Jacques Prieur";;;"Франция;MarketWinetime;Musigny;Jacques Prieur;Бургундия";"Domaine Jacques Prieur 2009, Musigny Grand Cru, 750 ml";"Франция, Бургундия";"Мощный, выразительный нюансированный аромат: свежая клубника, черешня, чайный лист, позднее проявляются цветок апельсинового дерева и абрикос. Вино среднетельное, с сильными танинами, пока что заметной дубовой нотой, очень выразительное, особенно ближе к финишу. Ему еще нужно набрать веса.<br /><em>Wine Advocate, 2010#nbsp; </em>";https://static.tildacdn.com/tild3264-6637-4834-b132-353466623539/206000-x-4000.jpg;219700.00;;;;;i92J13D3bfIV3K6JaL6j;;Франция;2009;Бургундия;"Пино Нуар";0,75;13%;;;;Красное;;;90;;;;0;0;0;0;;;;;https://winetime.moscow/domaine-jacques-prieur-2009
394359222361;"M. Chapoutier";;"RP 100";"Скидки недели;Франция;Избранное 2;MarketWinetime;M. Chapoutier;Долина Роны;Редкие вина";"M. Chapoutier, Ermitage «L'Ermite» 2010, 750 ml";"Франция, Долина Роны";"Эрмитаж Л’Эрмит 2010 от Шапутье очень сильно отличается от своего брата Ле Павильон - Л’Эрмит всегда чуть более терпкий. Цвет темно-фиолетовый, аромат плотный, с заметной минеральной составляющей: синие и темные фрукты, древесный уголь, стейк, цветочная нота. Вино полнотельное, танинное, чистое, у него экспансивная увесистая текстура. Великий терруар отражается в нем в концентрированном виде, как и сорт сира. Его нужно оставить в покое на 10-15 лет, возможно больше. прожить оно может 50-75 лет.#nbsp;<br /><em>Wine Advocate, 2012</em>";https://static.tildacdn.com/tild6665-3132-4439-b137-393333633861/246000-x-4000.jpg;96000.00;;;;;tFeJhFE6HIu6egdphlBv;;Франция;2009;"Долина Роны";сира;0,75;13%;100;;;Красное;;;;;;;0;0;0;0;;;;;https://winetime.moscow/ermitage-le-pavillon-2010
928729192851;"M. Chapoutier";;;"Франция;Избранное 2;MarketWinetime;E. Guigal;Долина Роны";"E. Guigal, La Landonne 2007, 750 ml";"Долина Роны";"Кот Роти Ла Ландон 2007 - вино, которое превосходно пьется уже сегодня благодаря мягкому характеру танинов - черте всего винтажа. В аромате - копченое мясо, тапенад, смородина и перец. Вино густое, полнотельное, очень пышное. Танины при этом сладние. В зрелость оно начнет входить через 5-6 лет, при этом пить его приятно и сейчас. Точно проживет еще 30+ лет.#nbsp;<br /><em>Wine Advocate, 2015</em>";https://static.tildacdn.com/tild6262-3764-4634-b234-393831386135/316000-x-4000.jpg;75000.00;;;;;YfL11XI8nYexabANTS2I;;Франция;2007;"Долина Роны";сира;0,75;13%;;;;Красное;;;97;;;;0;0;0;0;;;;;https://winetime.moscow/la-landonne-2007
397761395751;"M. Chapoutier";;"RP 100";"Франция;Избранное 2;MarketWinetime;E. Guigal;Долина Роны;Редкие вина";"E. Guigal, La Landonne 2009, 750 ml";"<strong>Долина Роны</strong>";"Кот Роти Ла Ландон 2009 - сногсшибательно прекрасное вино. В аромате - копченое мясо, дичь, маслины, древесный уголь, малина и перец. Вино суперконцентрированное, и несмотря на сочную фруктовость, танины сильно заметны - ему потребуется еще минимум 4-5 лет. Его ждет долгая жизнь - 50+ лет.#nbsp;<br /><br /><em>Wine Advocate, 2015</em>";https://static.tildacdn.com/tild6563-3638-4437-a263-333434333531/306000-x-4000.jpg;133000.00;;;;;gaZsH9JBLeM95lrnluro;;Франция;2009;"Долина Роны";сира;0,75;13%;;;;Красное;;;100;;;;0;0;0;0;;;;;https://winetime.moscow/la-landonne-2009
535174788611;"M. Chapoutier";;"RP 100";"Франция;Избранное 2;MarketWinetime;E. Guigal;Долина Роны;Редкие вина";"E. Guigal, La Mouline 2005, 750 ml";"Долина Роны";"Еще одна безупречная работа Гигаль - Кот Роти Ла Мулин 2005. Превосходно сбалансированное, суперконцентрированное и сногсшибательно мощное, оно в то же время обладает совершенно бесшовной, элегантной, шелковистой текстурой. В аромате - копченое мясо, железо, весенние цветы, малина, ежевика. Классический Ла Мулин, чистое и невероятно устойчивое. Можно пить уже сейчас и в течение ближайших 2-3 десятилетий.<br /><em>Wine Advocate, 2014</em>";https://static.tildacdn.com/tild3433-6666-4239-b165-653862333166/326000-x-4000.jpg;145000.00;;;;;NisTozzXYYR1MnkYx21z;;Франция;2005;"Долина Роны";сира;0,75;13%;;;;Красное;;;100;;;;0;0;0;0;;;;;https://winetime.moscow/la-mouline-2005
857991720921;"M. Chapoutier";;"RP 100";"Франция;Избранное 2;MarketWinetime;E. Guigal;Долина Роны;Редкие вина";"E. Guigal, La Mouline 2010, 750 ml";"Долина Роны";"У Кот Роти Ла Мулин 2010 неземной аромат весенних цветов, фимиама, фиалок, копченого мяса и сладкого черносмородинового ликера. Вино полнотельное, многослойное, с гладкой текстурой. Впечатляющее соблазнительное сира! Ему нужно еще 5-6 лет, чтобы войти в зрелость. Пейте в течение 20+ лет.<br /><em>Wine Advocate, 2014#nbsp; </em>";https://static.tildacdn.com/tild6430-6534-4037-a639-306432373930/336000-x-4000.jpg;135000.00;;;;;s7TmSO7oGZpCa2kIO9Nh;;Франция;2010;"Долина Роны";сира;0,75;13,50%;;;;Красное;;;100;;;;0;0;0;0;;;;;https://winetime.moscow/la-mouline-2010
819994721491;"M. Chapoutier";;;"Франция;Избранное 2;MarketWinetime;E. Guigal;Долина Роны";"E. Guigal, La Mouline 2011, 750 ml";"Долина Роны";"Кот Роти Ла Мулин 2011 - полнотельное, суперконцентрированное вино с маслянистой текстурой. В аромате - классические нотки Ла Мулин: копченое мясо, фиалки, малина, эспрессо и ваниль. Филипп Гигаль говорит, что главная проблема 2011 в том, что он идет прямо за 2010 и 2009. Но несмотря на то, что эти двое сильно перетянули одеяло на себя, 2011 доставляет такое же удовольствие, а еще его можно пить уже сейчас. Я бы все-таки посоветовал отложить его еще на 3-4 года.<br /><em>Wine Advocate, 2015 </em>";https://static.tildacdn.com/tild6435-6561-4161-b434-663036363461/346000-x-4000.jpg;80000.00;;;;;P51yDsaiOGA6vu8CC3j4;;Франция;2001;"Долина Роны";"89% сира, 11% вионье";0,75;13%;;;;Красное;;;98;;;;0;0;0;0;;;;;https://winetime.moscow/la-mouline-2011
256682289791;"M. Chapoutier";;;"Скидки недели;Франция;Избранное 2;MarketWinetime;E. Guigal;Долина Роны";"E. Guigal, La Turque 2007, 750 ml";"Долина Роны";"Кот Роти Ла Тюрк 2007 - элегантное вино с восхитительным ароматом копченого мяса, трюфеля, ежевики, черносмородинового ликера и тапенада. Вино полнотельное, с гладкой маслянистой текстурой и сладкими танинами. Его будет приятно пить в любое время в течение следующих двух десятилетий.#nbsp;<br /><em>Wine Advocate, 2016#nbsp;</em>";https://static.tildacdn.com/tild6164-6538-4865-a238-383337326361/266000-x-4000.jpg;79900.00;;;;;l36aosMhdGaKFYnoLeHV;;Франция;2007;"Долина Роны";"93% сира, 7% вионье";0,75;13%;;;;Красное;;;97;;;;0;0;0;0;;;;;https://winetime.moscow/la-turque-2007
810862882741;"M. Chapoutier";;"RP 100";"Франция;Избранное 2;MarketWinetime;E. Guigal;Долина Роны;Редкие вина";"E. Guigal, La Turque 2009, 750 ml";"Долина Роны";"Каждая дегустация вин 2009 и 2010 из Кот Роти напрочь выносит мозг, и эта не стала исключением. Ла Тюрк 2009 - роскошное вино с ароматом копченого мяса, ежевики, черной смородины и эспрессо. Плотное, маслянистое, очень концентрированное и устойчивое, это божественное вино можно пить уже сейчас и в любое время в течение следующих 20-30 лет.#nbsp;<br /><em>Wine Advocate, 2016 </em>";https://static.tildacdn.com/tild6235-3932-4863-b633-343663633038/DSC_0230-2.jpg;134000.00;;;;;f9i3342XnUuDT4lxoysO;;Франция;2001;"Долина Роны";"93% сира, 7% вионье";0,75;13%;;;;Красное;;;100;;;;0;0;0;0;;;;;https://winetime.moscow/la-turque-2009
323487346591;"Chateau Figeac";;;"Франция;Figeac;2015;Бордо";"Chateau Figeac 2012, 750 ml";"Бордо, Сент-Эмильон";"Аромат Шато Фижак 2012 производит немедленное впечатление: яркие ноты ежевики и малины, восхитительная минеральность и детализированность. Заметна графитовая нотка, характерная больше для Пойяка, чем для Сент-Эмильона. Вино среднетельное, с изящными танинами, заметной линией кислотности. Гармоничное и устойчивое. Очень элегантный, хорошо сделанный Фижак, который пока что в самом начале своего пути.#nbsp;<br /><em>Wine Advocate, 2016</em>";https://static.tildacdn.com/tild3239-6361-4039-b537-366537313965/26000-x-4000.jpg;32546.00;;;;;5yvJg5Pyzi7xTbllg4Am;;Франция;2012;Бордо;"мерло, каберне фран, каберне совиньон";0,75;14%;;Сент-Эмильон;;Красное;;;93;;;;0;0;0;0;;;;;https://winetime.moscow/figeac-2012
770766701231;"Chateau Lafite Rothschild";;;"France 2;Lafite;Пойяк;Бордо";"Chateau Lafite Rothschild 2002, 750 ml";"Бордо, Пойяк";"Глубокий фиолетовый цвет. Аромат многослойный, насыщенный: ежевика, грифель, маслины, подлесок и кедр. Классический Пойяк, вино все время развивается в бокале. Очень соблазнительная мягкая, шелковистая текстура, во вкусе - ежевика, лесные ягоды, сладкий инжир. Ближе к финишу это вино становится более танинным и сдержанным, будто говорит: “На сегодня все!” Очень интригующее, изменчивое вино.<br /><em>Wine Advocate, 2009</em>";https://static.tildacdn.com/tild3635-3265-4666-b933-303337333964/36000-x-4000.jpg;230100.00;;;;;N7rHPxFHMfrn6xIG6ayC;;Франция;2002;Бордо;"каберне совиньон, мерло, каберне фран";0,75;12,50%;;Пойяк;;Красное;;;94;;;;0;0;0;0;;;;;https://winetime.moscow/chateau-lafite-2002
279865129811;"Chateau Valandraud";;;"Франция;Chateau Valandraud;Бордо";"Chateau Valandraud 2004, 750 ml";"Бордо, Сент-Эмильон";"У Валандро 2004 более округлый и фруктовый букет, чем у Шеваль Блан того же года: красные фрукты, соус хойсин, мармелад и даже мед. Вино среднетельное, с мягкими округлыми танинами, при этом концентрация для 2004 года просто впечатляющая. Во вкусе - малиновое варенье, земляника, белый перец, кедр. Это вино сильно превосходит своего предшественника 2003, и его будет приятно пить в течение следующих 8-10 лет.#nbsp;<br /><em>Wine Advocate, 2016</em>#nbsp;";https://static.tildacdn.com/tild6339-6661-4031-a635-343438333965/DSC_0080-2.jpg;35938.00;;;;;ypCtXYsprJ4Gh7LgbdFx;;Франция;2004;Бордо;"75% мерло, 25% каберне фран";0,75;15%;;Сент-Эмильон;;Красное;;;91;;;;0;0;0;0;;;;;https://winetime.moscow/chateau-valandraud-2004
329764830431;"Chateau Valandraud";;;"Франция;Chateau Valandraud;Бордо";"Chateau Valandraud 2012, 750 ml";"Бордо, Сент-Эмильон";"Валандро 2012 демонстрирует значительный скачок в качестве по сравнению с предыдущим винтажем. У него молодой концентрированный букет с мощными нотами ежевики, черники и графита, которые с аэрацией становятся насыщеннее, но не теряют четкости. Вино среднетельное, с крошащимися танинами, благодаря которым текстура вина начинает напоминать известняк. Вкус чистый и свежий: ежевика, малина, графит, мел. Послевкусие яркое и устойчивое. Энергию этого вина, кажется, можно почувствовать физически. Оно изумительно и точно может считаться одним из лучших на Правом берегу. Очень рекомендую, но ему, конечно, нужно время.<br /><em>Wine Advocate, 2017<span class=""ql-cursor"">﻿</span></em>";https://static.tildacdn.com/tild6238-3736-4566-a533-343561383430/66000-x-4000.jpg;37460.00;;;;;DCLnlSaSVOrHcatd0PZJ;;Франция;2012;Бордо;"88% мерло, 12% каберне фран";0,75;14,50%;;Сент-Эмильон;;Красное;;;95;;;;0;0;0;0;;;;;https://winetime.moscow/chateau-valandraud-2012
247664579751;"Chateau Valandraud";;;"Франция;Chateau Valandraud;Бордо;Secret-Valndraud";"Chateau Valandraud 2016, 750 ml";"Бордо, Сент-Эмильон";"У Валандро 2016 насыщенный гранатово-фиолетовый цвет и сногсшибательный аромат темных фруктов, вишневого варенья, кофейных зерен, лакрицы, соуса хойсин, кедрового ореха и пряных трав. Вино полнотельное, насыщенное. танины зернистые, послевкусие фантастически долгое.#nbsp;<br /><em>Wine Advocate, 2018</em>";https://static.tildacdn.com/tild3530-3162-4731-b638-313962323763/76000-x-4000.jpg;42680.00;;;;;CJpX3s5DhJvk02JLgtU6;;Франция;2016;Бордо;"90% мерло, 7% каберне фран, 3% каберне совиньон";0,75;15%;;Сент-Эмильон;;Красное;;;96;;;;0;0;0;0;;;;;https://winetime.moscow/chateau-valandraud-2016
540601686251;"Chateau Valandraud";;;"Франция;Chateau Valandraud;Бордо;Secret-Valndraud";"Chateau Valandraud 2017, 750 ml";"Бордо, Сент-Эмильон";"У Валандро 2017 глубокий гранатово-фиолетовый цвет и аромат черной смородины, вишни в шоколаде, эспрессо, лакрицы, смолы и копченого мяса. Вино среднетельное, с заметными спелыми, сладкими танинами, очень свежее и фантастически фруктовое, с очень долгим ягодным послевкусием.#nbsp;<br /><em>Wine Advocate, 2018</em>";https://static.tildacdn.com/tild6661-3833-4736-b662-623136353836/66000-x-4000.jpg;35300.00;;;;;FUuzjsIZiPY79289IU7a;;Франция;2017;Бордо;"90% мерло, 7% каберне фран, 3% каберне совиньон";0,75;15%;;Сент-Эмильон;;Красное;;;94;;;;0;0;0;0;;;;;https://winetime.moscow/chateau-valandraud-2017
